<!ELEMENT documento (datos)>
<!ELEMENT datos (titulo, informacion)>
<!ELEMENT titulo (#PCDATA)>
<!ELEMENT imagen (#PCDATA)>
<!ELEMENT informacion (nombre, numero, validez, credito)>
<!ELEMENT nombre (#PCDATA)>
<!ELEMENT numero (#PCDATA)>
<!ELEMENT validez (#PCDATA)>
<!ELEMENT credito (#PCDATA)>